{
  "authoring_mode": "direct_text",
  "base_contract_hashes": {
    "godot-4.7:node:Node3D": "7e5e8a9788b6b911d5c34dcf7985b4d7b174d67c3c1e941efd8c7826ea857c06"
  },
  "child_constraints": [
    "具体子节点要求需由官方文档、源码或保存实验补充。"
  ],
  "context_requirements": [],
  "contract_hash": "7750b50bb0d525f4f9e1e9c23e6b5b46e41392f0692406f49f0cda6778da5f9b",
  "contract_id": "godot-4.7:node:Path3D",
  "contract_version": 2.0,
  "engine_build_hash": "a13da4feb8d8aefc283c3763d33a2f170a18d541",
  "engine_version": "4.7.1",
  "evidence": {
    "experiments": [
      "user://godot-dev/builtin-derive/node/path_3d-minimal.tscn",
      "user://godot-dev/builtin-verify/node/path_3d-direct.tscn"
    ],
    "official_docs": [
      "https://docs.godotengine.org/en/4.7/classes/class_path3d.html"
    ],
    "official_source": [],
    "reflection": [
      "Object.get_property_list 4.7.1；ClassDB.can_instantiate=true。"
    ]
  },
  "inheritance_chain": [
    "Path3D",
    "Node3D",
    "Node",
    "Object"
  ],
  "kind": "node",
  "lifecycle_constraints": [
    "加入 SceneTree 后验证；仅实例化成功不足以证明行为正确。"
  ],
  "path_constraints": [
    {
      "property": "visibility_parent",
      "resolution": "scene_tree",
      "target_type": "GeometryInstance3D"
    }
  ],
  "properties": [
    {
      "class_name": "",
      "default_value_text": "0",
      "hint": 2.0,
      "hint_string": "Inherit,Always,Disabled",
      "name": "auto_translate_mode",
      "type": "int",
      "usage": 6.0
    },
    {
      "class_name": "Curve3D",
      "default_value_text": "null",
      "hint": 17.0,
      "hint_string": "Curve3D",
      "name": "curve",
      "type": "Object",
      "usage": 67108870.0
    },
    {
      "class_name": "",
      "default_value_text": "Color(0, 0, 0, 1)",
      "hint": 0.0,
      "hint_string": "",
      "name": "debug_custom_color",
      "type": "Color",
      "usage": 6.0
    },
    {
      "class_name": "",
      "default_value_text": "\"\"",
      "hint": 18.0,
      "hint_string": "",
      "name": "editor_description",
      "type": "String",
      "usage": 6.0
    },
    {
      "class_name": "",
      "default_value_text": "0",
      "hint": 2.0,
      "hint_string": "Inherit,On,Off",
      "name": "physics_interpolation_mode",
      "type": "int",
      "usage": 6.0
    },
    {
      "class_name": "",
      "default_value_text": "0",
      "hint": 2.0,
      "hint_string": "Inherit,Pausable,When Paused,Always,Disabled",
      "name": "process_mode",
      "type": "int",
      "usage": 6.0
    },
    {
      "class_name": "",
      "default_value_text": "0",
      "hint": 0.0,
      "hint_string": "",
      "name": "process_physics_priority",
      "type": "int",
      "usage": 6.0
    },
    {
      "class_name": "",
      "default_value_text": "0",
      "hint": 0.0,
      "hint_string": "",
      "name": "process_priority",
      "type": "int",
      "usage": 6.0
    },
    {
      "class_name": "",
      "default_value_text": "0",
      "hint": 2.0,
      "hint_string": "Inherit,Main Thread,Sub Thread",
      "name": "process_thread_group",
      "type": "int",
      "usage": 6.0
    },
    {
      "class_name": "",
      "default_value_text": "0",
      "hint": 2.0,
      "hint_string": "Euler,Quaternion,Basis",
      "name": "rotation_edit_mode",
      "type": "int",
      "usage": 6.0
    },
    {
      "class_name": "",
      "default_value_text": "2",
      "hint": 2.0,
      "hint_string": "XYZ,XZY,YXZ,YZX,ZXY,ZYX",
      "name": "rotation_order",
      "type": "int",
      "usage": 6.0
    },
    {
      "class_name": "Script",
      "default_value_text": "null",
      "hint": 17.0,
      "hint_string": "Script",
      "name": "script",
      "type": "Object",
      "usage": 1048590.0
    },
    {
      "class_name": "",
      "default_value_text": "false",
      "hint": 0.0,
      "hint_string": "",
      "name": "top_level",
      "type": "bool",
      "usage": 6.0
    },
    {
      "class_name": "",
      "default_value_text": "Transform3D(1, 0, 0, 0, 1, 0, 0, 0, 1, 0, 0, 0)",
      "hint": 0.0,
      "hint_string": "suffix:m",
      "name": "transform",
      "type": "Transform3D",
      "usage": 2.0
    },
    {
      "class_name": "",
      "default_value_text": "false",
      "hint": 0.0,
      "hint_string": "",
      "name": "unique_name_in_owner",
      "type": "bool",
      "usage": 2.0
    },
    {
      "class_name": "",
      "default_value_text": "NodePath(\"\")",
      "hint": 26.0,
      "hint_string": "GeometryInstance3D",
      "name": "visibility_parent",
      "type": "NodePath",
      "usage": 6.0
    },
    {
      "class_name": "",
      "default_value_text": "true",
      "hint": 0.0,
      "hint_string": "",
      "name": "visible",
      "type": "bool",
      "usage": 6.0
    }
  ],
  "scope": "builtin",
  "serialization": {
    "format": "tscn-node",
    "minimal_text": "[gd_scene format=3]\n\n[node name=\"Path3D\" type=\"Path3D\"]\n",
    "notes": [
      "最小文本由 Godot 4.7.1 保存实验生成；独立验证阶段只读取本契约重建新文件。"
    ],
    "property_text_examples": {
      "debug_custom_color": "debug_custom_color = Color(0.25, 0.5, 0.75, 1)"
    }
  },
  "signals": [
    {
      "arguments": [
        {
          "class_name": "Node",
          "name": "node",
          "type": "Object"
        }
      ],
      "name": "child_entered_tree"
    },
    {
      "arguments": [
        {
          "class_name": "Node",
          "name": "node",
          "type": "Object"
        }
      ],
      "name": "child_exiting_tree"
    },
    {
      "arguments": [],
      "name": "child_order_changed"
    },
    {
      "arguments": [],
      "name": "curve_changed"
    },
    {
      "arguments": [],
      "name": "debug_color_changed"
    },
    {
      "arguments": [
        {
          "class_name": "Node",
          "name": "node",
          "type": "Object"
        }
      ],
      "name": "editor_description_changed"
    },
    {
      "arguments": [],
      "name": "editor_state_changed"
    },
    {
      "arguments": [],
      "name": "property_list_changed"
    },
    {
      "arguments": [],
      "name": "ready"
    },
    {
      "arguments": [],
      "name": "renamed"
    },
    {
      "arguments": [
        {
          "class_name": "Node",
          "name": "node",
          "type": "Object"
        }
      ],
      "name": "replacing_by"
    },
    {
      "arguments": [],
      "name": "script_changed"
    },
    {
      "arguments": [],
      "name": "tree_entered"
    },
    {
      "arguments": [],
      "name": "tree_exited"
    },
    {
      "arguments": [],
      "name": "tree_exiting"
    },
    {
      "arguments": [],
      "name": "visibility_changed"
    }
  ],
  "source_hash": "",
  "source_path": "",
  "status": "validated",
  "type_name": "Path3D",
  "validation": {
    "independent_text": true,
    "notes": [
      "representative_property={\"expected\":\"Color(0.25, 0.5, 0.75, 1)\",\"name\":\"debug_custom_color\"}",
      "nested_resource=curve:Curve3D",
      "independent_text=user://godot-dev/builtin-verify/node/path_3d-direct.tscn",
      "independent_text=user://godot-dev/builtin-verify/node/path_3d-direct.tscn"
    ],
    "save_reload": true
  }
}
