{
  "authoring_mode": "direct_text",
  "base_contract_hashes": {
    "godot-4.7:node:Node": "ea22211c95383df728f78b7e413451632d49f4f9a50bfe8a99f21079ddac4f63"
  },
  "child_constraints": [
    "具体子节点要求需由官方文档、源码或保存实验补充。"
  ],
  "context_requirements": [],
  "contract_hash": "7c435e0c207cf674611ac37b45f6ed2ded6554c91f111ee6a3fddcece483e41b",
  "contract_id": "godot-4.7:node:WorldEnvironment",
  "contract_version": 2.0,
  "engine_build_hash": "a13da4feb8d8aefc283c3763d33a2f170a18d541",
  "engine_version": "4.7.1",
  "evidence": {
    "experiments": [
      "user://godot-dev/builtin-derive/node/world_environment-minimal.tscn",
      "user://godot-dev/builtin-verify/node/world_environment-direct.tscn"
    ],
    "official_docs": [
      "https://docs.godotengine.org/en/4.7/classes/class_worldenvironment.html"
    ],
    "official_source": [],
    "reflection": [
      "Object.get_property_list 4.7.1；ClassDB.can_instantiate=true。"
    ]
  },
  "inheritance_chain": [
    "WorldEnvironment",
    "Node",
    "Object"
  ],
  "kind": "node",
  "lifecycle_constraints": [
    "加入 SceneTree 后验证；仅实例化成功不足以证明行为正确。"
  ],
  "path_constraints": [],
  "properties": [
    {
      "class_name": "",
      "default_value_text": "0",
      "hint": 2.0,
      "hint_string": "Inherit,Always,Disabled",
      "name": "auto_translate_mode",
      "type": "int",
      "usage": 6.0
    },
    {
      "class_name": "CameraAttributesPractical,CameraAttributesPhysical",
      "default_value_text": "null",
      "hint": 17.0,
      "hint_string": "CameraAttributesPractical,CameraAttributesPhysical",
      "name": "camera_attributes",
      "type": "Object",
      "usage": 6.0
    },
    {
      "class_name": "Compositor",
      "default_value_text": "null",
      "hint": 17.0,
      "hint_string": "Compositor",
      "name": "compositor",
      "type": "Object",
      "usage": 6.0
    },
    {
      "class_name": "",
      "default_value_text": "\"\"",
      "hint": 18.0,
      "hint_string": "",
      "name": "editor_description",
      "type": "String",
      "usage": 6.0
    },
    {
      "class_name": "Environment",
      "default_value_text": "null",
      "hint": 17.0,
      "hint_string": "Environment",
      "name": "environment",
      "type": "Object",
      "usage": 6.0
    },
    {
      "class_name": "",
      "default_value_text": "0",
      "hint": 2.0,
      "hint_string": "Inherit,On,Off",
      "name": "physics_interpolation_mode",
      "type": "int",
      "usage": 6.0
    },
    {
      "class_name": "",
      "default_value_text": "0",
      "hint": 2.0,
      "hint_string": "Inherit,Pausable,When Paused,Always,Disabled",
      "name": "process_mode",
      "type": "int",
      "usage": 6.0
    },
    {
      "class_name": "",
      "default_value_text": "0",
      "hint": 0.0,
      "hint_string": "",
      "name": "process_physics_priority",
      "type": "int",
      "usage": 6.0
    },
    {
      "class_name": "",
      "default_value_text": "0",
      "hint": 0.0,
      "hint_string": "",
      "name": "process_priority",
      "type": "int",
      "usage": 6.0
    },
    {
      "class_name": "",
      "default_value_text": "0",
      "hint": 2.0,
      "hint_string": "Inherit,Main Thread,Sub Thread",
      "name": "process_thread_group",
      "type": "int",
      "usage": 6.0
    },
    {
      "class_name": "Script",
      "default_value_text": "null",
      "hint": 17.0,
      "hint_string": "Script",
      "name": "script",
      "type": "Object",
      "usage": 1048590.0
    },
    {
      "class_name": "",
      "default_value_text": "false",
      "hint": 0.0,
      "hint_string": "",
      "name": "unique_name_in_owner",
      "type": "bool",
      "usage": 2.0
    }
  ],
  "scope": "builtin",
  "serialization": {
    "format": "tscn-node",
    "minimal_text": "[gd_scene format=3]\n\n[node name=\"WorldEnvironment\" type=\"WorldEnvironment\"]\n",
    "notes": [
      "最小文本由 Godot 4.7.1 保存实验生成；独立验证阶段只读取本契约重建新文件。"
    ],
    "property_text_examples": {
      "unique_name_in_owner": "unique_name_in_owner = true"
    }
  },
  "signals": [
    {
      "arguments": [
        {
          "class_name": "Node",
          "name": "node",
          "type": "Object"
        }
      ],
      "name": "child_entered_tree"
    },
    {
      "arguments": [
        {
          "class_name": "Node",
          "name": "node",
          "type": "Object"
        }
      ],
      "name": "child_exiting_tree"
    },
    {
      "arguments": [],
      "name": "child_order_changed"
    },
    {
      "arguments": [
        {
          "class_name": "Node",
          "name": "node",
          "type": "Object"
        }
      ],
      "name": "editor_description_changed"
    },
    {
      "arguments": [],
      "name": "editor_state_changed"
    },
    {
      "arguments": [],
      "name": "property_list_changed"
    },
    {
      "arguments": [],
      "name": "ready"
    },
    {
      "arguments": [],
      "name": "renamed"
    },
    {
      "arguments": [
        {
          "class_name": "Node",
          "name": "node",
          "type": "Object"
        }
      ],
      "name": "replacing_by"
    },
    {
      "arguments": [],
      "name": "script_changed"
    },
    {
      "arguments": [],
      "name": "tree_entered"
    },
    {
      "arguments": [],
      "name": "tree_exited"
    },
    {
      "arguments": [],
      "name": "tree_exiting"
    }
  ],
  "source_hash": "",
  "source_path": "",
  "status": "validated",
  "type_name": "WorldEnvironment",
  "validation": {
    "independent_text": true,
    "notes": [
      "representative_property={\"expected\":\"true\",\"name\":\"unique_name_in_owner\"}",
      "nested_resource=environment:Environment",
      "independent_text=user://godot-dev/builtin-verify/node/world_environment-direct.tscn",
      "independent_text=user://godot-dev/builtin-verify/node/world_environment-direct.tscn"
    ],
    "save_reload": true
  }
}
